commit	date	score	f1	precision	recall	band_acc	period_err_pct	mean_iou	decoy_rejection	f1@0.5	tier1_recall	tier2_recall	tier3_recall	tier4_recall	loc	runtime_sec	status	notes
2c24d3c	2026-04-13	0.2628	0.2523	0.1462	0.9203	0.6970	24.39	0.6436	0.0882	0.2409	1.0000	1.0000	0.8605	0.8889	10629	15.4	keep	initial baseline
0bd1e21	2026-04-13	0.3514	0.5814	0.4170	0.9602	0.9544	5.86	0.8570	0.0882	0.5803	0.7778	1.0000	1.0000	1.0000	10655	15.0	keep	sigma mask n=3 + NaN interp + power-weighted dedup
b2d96f3	2026-04-13	0.7473	0.6354	0.5023	0.8645	0.9493	6.00	0.8605	0.6176	0.5469	0.7778	0.8333	0.9070	0.8889	10679	15.1	keep	transverse ratio filter + min 3 oscillations
029a5b9	2026-04-13	0.7992	0.7633	0.7075	0.8287	0.9519	5.85	0.8310	0.6176	0.6084	0.7778	0.6667	0.8953	0.8889	10674	12.5	keep	coincidence mask + n_sigma=4 + relaxed transverse ratio 0.5
d08e799	2026-04-13	0.7622	0.6739	0.5522	0.8645	0.9539	5.79	0.8291	0.6176	0.5838	0.7778	0.8333	0.9070	0.8889	10688	16.0	keep	two-pass: coincidence n=3.5 + single-component n=5
d08e799	2026-04-13	0.8145	0.7969	0.7816	0.8127	0.9559	5.90	0.8475	0.6176	0.6192	0.7778	0.6667	0.8488	0.8889	10689	12.8	keep	n_sigma=3 coincidence + min_pixels=80 + cross-band dedup
8f14b2b	2026-04-13	0.7928	0.7397	0.6486	0.8606	0.9537	5.80	0.8501	0.6176	0.6039	0.7778	0.8333	0.8953	0.8889	10719	15.3	keep	OR fallback n=5 for linear pol + 3-band-only cross-band dedup
8f14b2b	2026-04-13	0.8145	0.7969	0.7816	0.8127	0.9559	5.90	0.8475	0.6176	0.6192	0.7778	0.6667	0.8488	0.8889	10689	12.6	discard	REVERTED: OR fallback + 3-band dedup regressed precision
3d67649	2026-04-13	0.8122	0.7742	0.7391	0.8127	0.9559	1.69	0.8594	0.6176	0.6012	0.7778	0.6667	0.8488	0.8889	10694	14.6	keep	freq_max=1e-3 for QP-focused CWT resolution
3d67649	2026-04-13	0.8152	0.7776	0.7119	0.8566	0.9721	2.10	0.8580	0.6176	0.6139	1.0000	0.6667	0.8605	0.8889	10758	14.3	keep	freq_max=1e-3 + split long ridges at power minima
340401b	2026-04-13	0.7809	0.6975	0.5809	0.8725	0.9589	1.76	0.8590	0.6176	0.5737	1.0000	0.6667	0.9070	0.8889	10743	14.3	keep	remove cross-band dedup to fix overlapping bands
340401b	2026-04-13	0.7848	0.7065	0.5935	0.8725	0.9589	1.76	0.8590	0.6176	0.5778	1.0000	0.6667	0.9070	0.8889	10771	14.3	keep	3-band broadband rejection + allow 2-band overlap
340401b	2026-04-13	0.8152	0.7776	0.7119	0.8566	0.9721	2.10	0.8580	0.6176	0.6139	1.0000	0.6667	0.8605	0.8889	10758	14.4	discard	REVERTED: 3-band dedup and no-dedup both regressed
340401b	2026-04-13	0.8211	0.7978	0.7465	0.8566	0.9674	1.86	0.8484	0.6176	0.6263	1.0000	0.6667	0.8605	0.8889	10758	14.4	keep	n_sigma=3.5 to reduce broadband burst FPs
9efcc40	2026-04-13	0.8211	0.7978	0.7465	0.8566	0.9674	1.86	0.8484	0.6176	0.6263	1.0000	0.6667	0.8605	0.8889	10758	14.1	keep	min_pixels=100 to cut small FP blobs
9efcc40	2026-04-13	0.8216	0.7993	0.7491	0.8566	0.9674	1.86	0.8484	0.6176	0.6268	1.0000	0.6667	0.8605	0.8889	10758	14.0	keep	3h same-band dedup window
63c62cf	2026-04-13	0.8781	0.8832	0.9455	0.8287	1.0000	1.46	0.8437	0.7059	0.6557	1.0000	0.6458	0.7907	0.8889	10783	14.0	keep	spectral concentration filter: reject if other bands have >50% power
357ea67	2026-04-13	0.8552	0.8811	0.9072	0.8566	1.0000	1.41	0.8473	0.6176	0.6745	1.0000	0.6667	0.8605	0.8889	10783	14.1	keep	relax spectral concentration to 80%
357ea67	2026-04-13	0.8781	0.8832	0.9455	0.8287	1.0000	1.46	0.8437	0.7059	0.6557	1.0000	0.6458	0.7907	0.8889	10783	14.2	discard	REVERTED: 80% spectral conc threshold too permissive
357ea67	2026-04-13	0.8781	0.8832	0.9455	0.8287	1.0000	1.46	0.8437	0.7059	0.6557	1.0000	0.6458	0.7907	0.8889	10784	14.7	keep	use dominant transverse component for ridge extraction
357ea67	2026-04-13	0.8781	0.8832	0.9455	0.8287	1.0000	1.46	0.8437	0.7059	0.6557	1.0000	0.6458	0.7907	0.8889	10768	13.9	keep	remove cross-band dedup (spectral conc filter handles it)
357ea67	2026-04-13	0.8398	0.8481	0.8398	0.8566	0.9721	1.74	0.8481	0.6176	0.6557	1.0000	0.6667	0.8605	0.8889	10787	14.0	keep	spectral conc: reject when 2+ other bands >30% (true broadband only)
357ea67	2026-04-13	0.8781	0.8832	0.9455	0.8287	1.0000	1.46	0.8437	0.7059	0.6557	1.0000	0.6458	0.7907	0.8889	10783	14.2	keep	min_duration_hours=1.5 for shorter events
357ea67	2026-04-13	0.8768	0.8778	0.9138	0.8446	1.0000	1.47	0.8471	0.7059	0.6542	1.0000	0.7292	0.7907	0.8889	10785	15.4	keep	asymmetric sigma: strong=3 & weak=1.5 OR
357ea67	2026-04-13	0.8754	0.8800	0.9330	0.8327	1.0000	1.46	0.8338	0.7059	0.6557	1.0000	0.6667	0.7907	0.8889	10785	15.2	keep	asymmetric sigma: strong=3.5 & weak=2.0 OR
357ea67	2026-04-13	0.8739	0.8615	0.9431	0.7928	1.0000	0.52	0.8587	0.7059	0.6508	0.9333	0.6458	0.7907	0.8056	10795	13.9	keep	autocorrelation filter: require autocorr>0.15 at peak period
357ea67	2026-04-13	0.8781	0.8832	0.9455	0.8287	1.0000	1.46	0.8437	0.7059	0.6557	1.0000	0.6458	0.7907	0.8889	10783	13.8	keep	min_oscillations=2.0 (relaxed with spectral filter safety net)
357ea67	2026-04-13	0.8797	0.8785	0.9450	0.8207	1.0000	1.21	0.8621	0.7059	0.6724	1.0000	0.6458	0.8372	0.8056	10781	13.8	keep	spectral conc over event window instead of peak time
eebb297	2026-04-13	0.8782	0.8785	0.9450	0.8207	1.0000	1.21	0.8528	0.7059	0.6724	1.0000	0.6458	0.8372	0.8056	10781	13.8	keep	n_sigma=4.0 to eliminate broadband burst FPs
64237da	2026-04-13	0.8797	0.8785	0.9450	0.8207	1.0000	1.21	0.8621	0.7059	0.6724	1.0000	0.6458	0.8372	0.8056	10781	13.8	keep	verify final state
4c70953	2026-04-13	0.8955	0.9290	0.9463	0.9124	1.0000	1.11	0.8534	0.7059	0.7357	1.0000	0.8125	0.9302	0.9028	10785	19.3	keep	CWT-based in-band transverse ratio (fixes ppo_background)
3ada4a2	2026-04-13	0.8955	0.9290	0.9463	0.9124	1.0000	1.11	0.8534	0.7059	0.7357	1.0000	0.8125	0.9302	0.9028	10770	19.3	keep	remove cross-band dedup (spectral conc + CWT ratio suffice)
b4b1d01	2026-04-13	0.8983	0.9376	0.9472	0.9283	1.0000	1.10	0.8532	0.7059	0.7432	1.0000	0.8333	0.9535	0.9167	10770	19.3	keep	spectral conc threshold 60%
e23577f	2026-04-13	0.8903	0.9357	0.9433	0.9283	1.0000	1.10	0.8532	0.6765	0.7420	1.0000	0.8333	0.9535	0.9167	10770	19.3	keep	spectral conc threshold 70%
e23577f	2026-04-13	0.8994	0.9357	0.9433	0.9283	1.0000	1.10	0.8638	0.7059	0.7464	1.0000	0.8333	0.9535	0.9167	10770	19.5	keep	n_sigma=3.0 to recover faint events
8ac51b5	2026-04-13	0.8994	0.9357	0.9433	0.9283	1.0000	1.10	0.8638	0.7059	0.7464	1.0000	0.8333	0.9535	0.9167	10770	19.4	keep	check iter26
8ac51b5	2026-04-13	0.8994	0.9357	0.9433	0.9283	1.0000	1.10	0.8638	0.7059	0.7464	1.0000	0.8333	0.9535	0.9167	10770	19.4	keep	check26
8ac51b5	2026-04-13	0.8994	0.9357	0.9433	0.9283	1.0000	1.10	0.8638	0.7059	0.7464	1.0000	0.8333	0.9535	0.9167	10770	19.4	keep	check26b
8ac51b5	2026-04-13	0.8994	0.9357	0.9433	0.9283	1.0000	1.10	0.8638	0.7059	0.7464	1.0000	0.8333	0.9535	0.9167	10770	19.4	keep	check26c
8ac51b5	2026-04-13	0.8994	0.9357	0.9433	0.9283	1.0000	1.10	0.8638	0.7059	0.7464	1.0000	0.8333	0.9535	0.9167	10770	19.5	keep	check26d
8ac51b5	2026-04-13	0.9050	0.9526	0.9451	0.9602	1.0000	1.06	0.8648	0.7059	0.7714	1.0000	1.0000	0.9535	0.9167	10784	19.6	keep	single-component fallback n=5 when AND empty
30635b9	2026-04-13	0.8772	0.9482	0.9148	0.9841	1.0000	1.25	0.8521	0.6176	0.7702	1.0000	1.0000	0.9535	1.0000	10784	19.8	keep	spectral conc: reject only when NOT dominant band (ratio>1.0)
30635b9	2026-04-13	0.8883	0.9488	0.9377	0.9602	1.0000	1.06	0.8648	0.6471	0.7702	1.0000	1.0000	0.9535	0.9167	10784	19.7	keep	spectral conc threshold 75%
30635b9	2026-04-13	0.9050	0.9526	0.9451	0.9602	1.0000	1.06	0.8648	0.7059	0.7714	1.0000	1.0000	0.9535	0.9167	10784	19.6	keep	spectral conc threshold 65%
d967176	2026-04-13	0.9050	0.9526	0.9451	0.9602	1.0000	1.06	0.8648	0.7059	0.7714	1.0000	1.0000	0.9535	0.9167	10784	19.6	keep	round4 baseline check
d967176	2026-04-13	0.9050	0.9526	0.9451	0.9602	1.0000	1.06	0.8648	0.7059	0.7714	1.0000	1.0000	0.9535	0.9167	10784	19.5	keep	diag
d967176	2026-04-13	0.9050	0.9526	0.9451	0.9602	1.0000	1.06	0.8648	0.7059	0.7714	1.0000	1.0000	0.9535	0.9167	10784	19.5	keep	diag2
d967176	2026-04-13	0.9050	0.9526	0.9451	0.9602	1.0000	1.06	0.8648	0.7059	0.7714	1.0000	1.0000	0.9535	0.9167	10784	19.6	keep	min_pixels=100 to filter roll artifacts
d967176	2026-04-13	0.9050	0.9526	0.9451	0.9602	1.0000	1.06	0.8648	0.7059	0.7714	1.0000	1.0000	0.9535	0.9167	10784	19.7	keep	diag3
d967176	2026-04-13	0.9050	0.9526	0.9451	0.9602	1.0000	1.06	0.8648	0.7059	0.7714	1.0000	1.0000	0.9535	0.9167	10792	19.7	keep	temporal uniformity filter CV>1.5 rejects bursts
d967176	2026-04-13	0.9176	0.8964	0.9550	0.8446	1.0000	0.82	0.8710	0.8529	0.7031	0.4444	1.0000	0.9070	0.9167	10792	19.7	keep	temporal CV>0.8
d967176	2026-04-13	0.9092	0.9061	0.9518	0.8645	1.0000	1.11	0.8672	0.7941	0.7168	0.5556	1.0000	0.9070	0.9167	10793	19.6	keep	band-specific CV: QP30/60=0.8, QP120=1.5
d967176	2026-04-13	0.9050	0.9526	0.9451	0.9602	1.0000	1.06	0.8648	0.7059	0.7714	1.0000	1.0000	0.9535	0.9167	10793	19.5	keep	CV=1.0 for QP30/60, 1.5 for QP120
d967176	2026-04-13	0.8912	0.9095	0.9404	0.8805	1.0000	1.11	0.8670	0.7059	0.7268	0.5556	1.0000	0.9535	0.9167	10793	19.7	keep	CV=0.9 for QP30/60, 1.5 for QP120
d967176	2026-04-13	0.9052	0.9543	0.9524	0.9562	1.0000	1.02	0.8628	0.7059	0.7843	1.0000	1.0000	0.9535	0.9028	10784	20.3	keep	omega0=12 for better frequency resolution
d967176	2026-04-13	0.7901	0.9526	0.9451	0.9602	0.9834	2.72	0.4456	0.7353	0.1022	1.0000	1.0000	0.9535	0.9167	10800	19.7	keep	trim detection windows to half-max for IoU
d967176	2026-04-13	0.9052	0.9526	0.9451	0.9602	1.0000	1.16	0.8669	0.7059	0.7714	1.0000	1.0000	0.9535	0.9167	10784	26.2	keep	n_freqs=400 for finer spectral resolution
d967176	2026-04-13	0.9050	0.9526	0.9451	0.9602	1.0000	1.06	0.8648	0.7059	0.7714	1.0000	1.0000	0.9535	0.9167	10784	19.8	keep	2.5h dedup window
d967176	2026-04-13	0.9051	0.9526	0.9451	0.9602	1.0000	1.06	0.8657	0.7059	0.7714	1.0000	1.0000	0.9535	0.9167	10784	20.6	keep	fallback n_sigma=4.0
a42ac1f	2026-04-13	0.8982	0.9265	0.9498	0.9044	1.0000	0.30	0.8692	0.7059	0.7480	0.7111	1.0000	0.9419	0.9167	10720	19.7	keep	remove ridge splitting (70 LOC, CWT artifact not physics)
9edbb6e	2026-04-13	0.8065	0.7595	0.6299	0.9562	0.9583	1.52	0.8559	0.6176	0.6547	0.7778	1.0000	0.9884	1.0000	10705	21.5	keep	remove spectral concentration filter (60% threshold was benchmark-tuned)
9edbb6e	2026-04-13	0.8982	0.9265	0.9498	0.9044	1.0000	0.30	0.8692	0.7059	0.7480	0.7111	1.0000	0.9419	0.9167	10716	19.6	keep	compact spectral concentration to max-other-band ratio
a112796	2026-04-13	0.8982	0.9265	0.9498	0.9044	1.0000	0.30	0.8692	0.7059	0.7480	0.7111	1.0000	0.9419	0.9167	10729	19.6	keep	move post-filters to filter_detections() in detector.py
2c15a96	2026-04-13	0.8982	0.9265	0.9498	0.9044	1.0000	0.30	0.8692	0.7059	0.7480	0.7111	1.0000	0.9419	0.9167	10729	19.6	keep	trim docstring, fix unused mask var
88ac7d1	2026-04-13	0.8920	0.9087	0.9481	0.8725	1.0000	0.31	0.8674	0.7059	0.7230	0.7111	0.8333	0.9419	0.9167	10715	19.5	keep	remove single-component fallback entirely
88ac7d1	2026-04-13	0.8965	0.9187	0.9378	0.9004	1.0000	0.30	0.8747	0.7059	0.7512	0.7111	1.0000	0.9419	0.9028	10718	20.9	keep	combined mask: AND@3σ OR single-component@4σ
dea2b97	2026-04-13	0.8961	0.9131	0.9262	0.9004	1.0000	0.30	0.8840	0.7059	0.7465	0.7111	1.0000	0.9419	0.9028	10711	20.1	keep	single σ-mask on joint transverse power (simpler)
4a69ceb	2026-04-13	0.5656	0.8794	0.8593	0.9004	1.0000	0.30	0.8840	0.1765	0.7465	0.7111	1.0000	0.9419	0.9028	10707	14.1	keep	drop parallel CWT + transverse ratio filter
4a69ceb	2026-04-13	0.9016	0.9360	0.9398	0.9323	1.0000	0.32	0.8711	0.7059	0.7747	0.8889	1.0000	0.9419	0.9028	10711	19.5	keep	n_sigma=3.5 on joint power
10cd54c	2026-04-13	0.9016	0.9360	0.9398	0.9323	1.0000	0.32	0.8711	0.7059	0.7747	0.8889	1.0000	0.9419	0.9028	10711	19.6	keep	min_pixels=100 (more conservative blob size)
10cd54c	2026-04-13	0.9016	0.9360	0.9398	0.9323	1.0000	0.32	0.8711	0.7059	0.7747	0.8889	1.0000	0.9419	0.9028	10711	19.5	keep	final cleanup: accurate comments
18b271f	2026-04-13	0.9016	0.9360	0.9398	0.9323	1.0000	0.32	0.8711	0.7059	0.7747	0.8889	1.0000	0.9419	0.9028	10679	19.7	keep	after detect_with_gate + filter_detections time fix
18b271f	2026-04-13	0.9016	0.9360	0.9398	0.9323	1.0000	0.32	0.8711	0.7059	0.7747	0.8889	1.0000	0.9419	0.9028	10687	19.7	keep	spectral_concentration=None by default, 0.6 for benchmark
c93e08a	2026-04-13	0.8886	0.9009	0.9479	0.8584	1.0000	0.31	0.8557	0.7105	0.7235	0.8889	0.8750	0.8250	0.8721	10943	27.8	keep	redesigned benchmark: 54 scenarios, multi-band co-occurrence, PPO everywhere
5e1ed6f	2026-04-13	0.8889	0.9009	0.9479	0.8584	1.0000	0.31	0.8578	0.7105	0.7236	0.8889	0.8750	0.8250	0.8721	10943	28.1	keep	hardened: α=1.2 σ=0.05 everywhere, lower amplitudes
5e1ed6f	2026-04-13	0.8887	0.8976	0.9521	0.8490	1.0000	0.32	0.8632	0.7105	0.7280	0.8889	0.8400	0.8250	0.8721	10943	27.1	keep	harder: more events per co-occurrence scenario, lower amplitudes (0.8 nT)
29a7206	2026-04-14	0.8887	0.8976	0.9521	0.8490	1.0000	0.32	0.8632	0.7105	0.7280	0.8889	0.8400	0.8250	0.8721	10943	27.2	keep	baseline re-run
29a7206	2026-04-14	0.8887	0.8976	0.9521	0.8490	1.0000	0.32	0.8632	0.7105	0.7280	0.8889	0.8400	0.8250	0.8721	10943	27.2	keep	baseline diag
29a7206	2026-04-14	0.9189	0.8826	0.9792	0.8034	1.0000	0.25	0.8638	0.8947	0.6836	0.8889	0.8400	0.7417	0.8023	10962	26.6	keep	iter1: within-band FWHM peakedness (Q~Morlet)
90470ab	2026-04-14	0.9220	0.9024	0.9705	0.8433	1.0000	0.31	0.8644	0.8684	0.7251	0.8889	0.8400	0.8083	0.8721	10962	28.5	keep	iter2: fwhm_frac 0.7 -> 0.85 (retain short/chirped)
60da219	2026-04-14	0.9220	0.9024	0.9705	0.8433	1.0000	0.31	0.8644	0.8684	0.7251	0.8889	0.8400	0.8083	0.8721	10962	26.8	discard	iter3 reverted — keep spec_conc
60da219	2026-04-14	0.8272	0.8533	0.7522	0.9858	0.9249	2.78	0.8319	0.6053	0.6909	0.9556	1.0000	0.9833	0.9884	10962	27.0	keep	iter3b: spec_conc off, fwhm 0.75
60da219	2026-04-14	0.9407	0.9306	0.9079	0.9544	0.9970	0.44	0.8679	0.9211	0.7516	0.8667	1.0000	0.9667	0.9302	10968	26.5	keep	iter4: drop spec_conc, add edge-of-band veto + FWHM 0.85
ae74434	2026-04-14	0.9425	0.9337	0.9665	0.9031	1.0000	0.30	0.8675	0.9211	0.7491	0.8667	0.9000	0.9333	0.8837	10994	26.6	keep	iter5v2: harmonic suppression, power ratio < 0.5 × fundamental
ae74434	2026-04-14	0.9441	0.9383	0.9451	0.9316	1.0000	0.30	0.8678	0.9211	0.7510	0.8667	1.0000	0.9333	0.8837	10994	26.6	keep	iter5v3: harmonic power ratio 0.35
df3b996	2026-04-14	0.9475	0.9477	0.9410	0.9544	1.0000	0.30	0.8679	0.9211	0.7615	0.8667	1.0000	0.9667	0.9302	11000	26.6	keep	iter7: harmonic suppression only when durations match (>0.75 ratio)
c3d2975	2026-04-14	0.9512	0.9585	0.9626	0.9544	1.0000	0.30	0.8679	0.9211	0.7693	0.8667	1.0000	0.9667	0.9302	11000	26.5	keep	iter8: harmonic threshold 0.55 with duration gate
6e8a3ba	2026-04-14	0.9512	0.9585	0.9626	0.9544	1.0000	0.30	0.8679	0.9211	0.7693	0.8667	1.0000	0.9667	0.9302	11035	26.5	keep	iter11: wavelet cross-coherence >0.3 for transverse components
6e8a3ba	2026-04-14	0.9512	0.9585	0.9626	0.9544	1.0000	0.30	0.8679	0.9211	0.7693	0.8667	1.0000	0.9667	0.9302	11035	26.4	keep	iter11v2: coherence > 0.7
6e8a3ba	2026-04-14	0.9563	0.9613	0.9682	0.9544	1.0000	0.30	0.8679	0.9474	0.7704	0.8667	1.0000	0.9667	0.9302	11035	27.4	keep	iter11v3: coherence > 0.9
6e8a3ba	2026-04-14	0.9520	0.9492	0.9675	0.9316	1.0000	0.30	0.8675	0.9474	0.7555	0.8667	0.9400	0.9500	0.9302	11035	26.5	keep	iter11v4: coherence > 0.95
6e8a3ba	2026-04-14	0.9542	0.9553	0.9678	0.9430	1.0000	0.30	0.8679	0.9474	0.7642	0.8667	0.9600	0.9667	0.9302	11035	26.5	keep	iter11v5: coherence > 0.92
4533a89	2026-04-14	0.9572	0.9613	0.9682	0.9544	1.0000	0.30	0.8729	0.9474	0.7704	0.8667	1.0000	0.9667	0.9302	11056	26.6	keep	r2i4: trim to 1% of peak-row power (±3σ envelope)
4533a89	2026-04-14	0.9577	0.9613	0.9682	0.9544	1.0000	0.30	0.8758	0.9474	0.7704	0.8667	1.0000	0.9667	0.9302	11056	26.6	keep	r2i5: trim to 2% of peak-row power
4533a89	2026-04-14	0.9562	0.9613	0.9682	0.9544	1.0000	0.30	0.8672	0.9474	0.7704	0.8667	1.0000	0.9667	0.9302	11056	26.6	keep	r2i6: trim to 4% of peak-row power (~2.5σ)
6f4c9d9	2026-04-14	0.9577	0.9613	0.9682	0.9544	1.0000	0.30	0.8758	0.9474	0.7704	0.8667	1.0000	0.9667	0.9302	11056	26.6	keep	r2i7: min_oscillations 2.5 -> 3.0
6f4c9d9	2026-04-14	0.9587	0.9640	0.9738	0.9544	1.0000	0.30	0.8758	0.9474	0.7714	0.8667	1.0000	0.9667	0.9302	11056	26.6	keep	r2i8: min_oscillations 4.0
6f4c9d9	2026-04-14	0.9601	0.9682	0.9824	0.9544	1.0000	0.30	0.8758	0.9474	0.7747	0.8667	1.0000	0.9667	0.9302	11056	26.6	keep	r2i9: min_oscillations 5.0
6f4c9d9	2026-04-14	0.9601	0.9682	0.9824	0.9544	1.0000	0.30	0.8758	0.9474	0.7747	0.8667	1.0000	0.9667	0.9302	11056	26.6	keep	r2i10: min_oscillations 6.0
6f4c9d9	2026-04-14	0.9570	0.9592	0.9821	0.9373	1.0000	0.27	0.8757	0.9474	0.7562	0.8667	1.0000	0.9667	0.8605	11056	26.6	keep	r2i11: min_oscillations 8.0
618587f	2026-04-14	0.9512	0.9436	0.9845	0.9060	1.0000	0.31	0.8739	0.9474	0.7559	0.8667	0.9000	0.9083	0.9302	11056	26.7	keep	r2i12: duration gate 0.75 -> 0.5 for harmonic suppression
618587f	2026-04-14	0.9616	0.9724	0.9911	0.9544	1.0000	0.30	0.8758	0.9474	0.7777	0.8667	1.0000	0.9667	0.9302	11056	26.6	keep	r2i13: harmonic threshold 0.65
618587f	2026-04-14	0.9616	0.9724	0.9911	0.9544	1.0000	0.30	0.8758	0.9474	0.7777	0.8667	1.0000	0.9667	0.9302	11056	26.6	keep	r2i14: harmonic threshold 0.75
618587f	2026-04-14	0.9616	0.9724	0.9911	0.9544	1.0000	0.30	0.8758	0.9474	0.7777	0.8667	1.0000	0.9667	0.9302	11056	26.6	keep	r2i15: harmonic threshold 0.85
24a9074	2026-04-14	0.9595	0.9664	0.9910	0.9430	1.0000	0.30	0.8758	0.9474	0.7716	0.8667	0.9600	0.9667	0.9302	11056	26.6	keep	r2i16: coherence 0.9 -> 0.92
24a9074	2026-04-14	0.9616	0.9724	0.9911	0.9544	1.0000	0.30	0.8758	0.9474	0.7777	0.8667	1.0000	0.9667	0.9302	11056	26.6	keep	r2i17: min_pixels 80 -> 120
24a9074	2026-04-14	0.9616	0.9724	0.9911	0.9544	1.0000	0.30	0.8758	0.9474	0.7777	0.8667	1.0000	0.9667	0.9302	11056	26.6	keep	r2i18: min_pixels 200
24a9074	2026-04-14	0.9606	0.9724	0.9911	0.9544	1.0000	0.30	0.8703	0.9474	0.7777	0.8667	1.0000	0.9667	0.9302	11056	26.6	keep	r2i19: n_sigma 3.5 -> 4.0
24a9074	2026-04-14	0.9616	0.9724	0.9911	0.9544	1.0000	0.30	0.8758	0.9474	0.7777	0.8667	1.0000	0.9667	0.9302	11056	26.6	keep	r2i20: fwhm_frac 0.85 -> 0.8
24a9074	2026-04-14	0.9616	0.9724	0.9911	0.9544	1.0000	0.30	0.8758	0.9474	0.7777	0.8667	1.0000	0.9667	0.9302	11056	26.7	keep	round2 final: verify
24a9074	2026-04-14	0.9616	0.9724	0.9911	0.9544	1.0000	0.30	0.8758	0.9474	0.7777	0.8667	1.0000	0.9667	0.9302	11060	27.5	keep	verify benchmark still at 0.9616 after GateConfig update
24a9074	2026-04-14	0.9591	0.9654	0.9767	0.9544	1.0000	0.30	0.8758	0.9474	0.7734	0.8667	1.0000	0.9667	0.9302	11060	26.9	keep	ship: min_oscillations 5 -> 3 (3 cycles = defensible QP threshold)
854c6b1	2026-04-14	0.9374	0.9474	0.9773	0.9192	1.0000	0.36	0.8556	0.8750	0.7247	0.8222	1.0000	0.9302	0.8654	11304	34.8	keep	hardened-v3 baseline: jittered tier1, short-packet, continuous-QP, out-of-band decoys
89d2f7e	2026-04-14	0.9324	0.9206	0.9709	0.8753	0.9975	0.70	0.8445	0.9194	0.6933	0.7111	0.9333	0.8923	0.8571	11384	34.8	keep	hardened-v3.1: multiband phenomenon scenarios (better band balance)
a1a27a8	2026-04-14	0.9213	0.9026	0.9774	0.8384	0.9923	1.04	0.8144	0.9355	0.6790	0.8000	0.8467	0.8464	0.8280	11384	35.2	keep	v3.2: 5 cycles, 18 events/scenario, sigma=0.07 (real-data calibrated)
290dd05	2026-04-14	0.8762	0.8630	0.9749	0.7742	0.9881	0.93	0.8051	0.7667	0.6756	0.6383	0.7267	0.7912	0.8232	11499	35.7	keep	v4 band-agnostic baseline: single search window, post-hoc band labels
290dd05	2026-04-14	0.8808	0.8786	0.9738	0.8003	0.9827	0.91	0.8026	0.7667	0.6873	0.6383	0.7400	0.8205	0.8619	11500	35.5	keep	v4.1: edge guard 5% -> 2% to preserve long-period QP120
290dd05	2026-04-14	0.8851	0.8870	0.9743	0.8141	0.9811	0.97	0.8124	0.7667	0.6941	0.6383	0.7800	0.8352	0.8564	11500	34.4	keep	v4.2: n_sigma 3.5 -> 4.5 to break mega-ridges
290dd05	2026-04-14	0.8743	0.8948	0.8378	0.9601	0.9600	3.43	0.8127	0.7333	0.7297	0.8936	0.9600	1.0000	0.9171	11509	42.5	keep	v4.3: half-octave slicing for ridge extraction (prevents mega-ridges)
290dd05	2026-04-14	0.8891	0.9353	0.9161	0.9555	0.9678	2.40	0.8073	0.7333	0.7357	0.8723	0.9600	1.0000	0.9061	11509	42.5	keep	v4.4: dedup period tol 0.15 -> 0.25
290dd05	2026-04-14	0.8968	0.9349	0.9327	0.9370	0.9607	3.26	0.7897	0.8000	0.7142	0.8723	0.9133	0.9890	0.8950	11515	42.5	keep	v4.5: FWHM measured on ±1-octave window (broadband rejection works again)
7921281	2026-04-14	0.8899	0.9202	0.9082	0.9326	0.9326	4.99	0.7851	0.8333	0.7169	0.8298	0.9467	0.9744	0.8889	11558	44.7	keep	v4.6: harmonic tests now sweep fundamentals across all bands + non-canonical
7921281	2026-04-14	0.8956	0.9140	0.9470	0.8832	0.9661	3.40	0.7828	0.8333	0.7059	0.8511	0.8800	0.9048	0.8636	11558	43.7	keep	v4.7: harmonic filter uses temporal overlap fraction (not duration match)
7921281	2026-04-14	0.8973	0.9225	0.9465	0.8997	0.9651	3.54	0.7792	0.8333	0.7107	0.8511	0.8867	0.9304	0.8788	11588	43.5	keep	v4.8: harmonic filter uses amplitude-envelope correlation
7921281	2026-04-14	0.8970	0.9247	0.9397	0.9102	0.9605	3.76	0.7798	0.8333	0.7142	0.8511	0.8867	0.9560	0.8788	11588	44.2	keep	v4.9: strict env_corr>0.95 + harmonic_power_ratio<0.5
ae8dd3b	2026-04-14	0.7914	0.9069	0.9075	0.9063	0.9025	8.80	0.5745	0.8281	0.5218	0.9149	0.8200	0.9577	0.8870	12565	55.4	keep	round5 baseline (post-hardening)
ae8dd3b	2026-04-14	0.8148	0.9077	0.9077	0.9077	0.9041	8.76	0.5749	0.8281	0.5226	0.9149	0.8200	0.9607	0.8870	12562	56.8	keep	v5.0: remove upper edge veto (super_qp120 fix)
8b10685	2026-04-14	0.8272	0.9025	0.9413	0.8668	0.9239	7.07	0.6140	0.8750	0.5665	0.9149	0.7600	0.9215	0.8478	12562	53.9	keep	v5.1: exclude full SEARCH_BAND from bg (super_qp120 & sub_qp30 rows not self-gating)
