commit	date	score	f1	precision	recall	band_acc	period_err_pct	mean_iou	decoy_rejection	f1@0.5	tier1_recall	tier2_recall	tier3_recall	tier4_recall	loc	runtime_sec	status	notes
8b10685	2026-04-14	0.8108	0.9087	0.9046	0.9129	0.8931	9.61	0.5635	0.8281	0.5085	0.8936	0.8267	0.9637	0.9000	12568	56.5	keep	v5.2: exclude super_qp120 from bg rows
8b10685	2026-04-14	0.8240	0.9101	0.9125	0.9077	0.9041	8.76	0.5749	0.8906	0.5226	0.9149	0.8200	0.9607	0.8870	12575	56.4	keep	v5.3: crest-factor veto (max/median(|b⊥|) < 20)
65222e3	2026-04-14	0.8286	0.9317	0.9556	0.9090	0.9100	7.90	0.5653	0.8906	0.5127	0.9149	0.8200	0.9637	0.8870	12577	56.1	keep	v5.4: NMS dedup (sort by prominence, order-invariant)
82785b8	2026-04-14	0.8244	0.9212	0.9586	0.8865	0.9003	8.51	0.5729	0.8906	0.5238	0.9149	0.8067	0.9245	0.8783	12577	56.0	keep	v5.5: tighten max_fwhm 0.3->0.25 for broadband decoys
82785b8	2026-04-14	0.6815	0.6890	0.5505	0.9208	0.8338	14.14	0.5550	0.5521	0.3957	0.9149	0.8667	0.9637	0.8957	12578	57.1	keep	v5.5: σ-mask on transverse-excess (joint_perp - par)
82785b8	2026-04-14	0.8177	0.9037	0.9755	0.8417	0.9592	4.15	0.5619	0.8906	0.5077	0.8723	0.8133	0.8761	0.8043	12581	56.3	keep	v5.6: time-overlap dedup catches chirps
82785b8	2026-04-14	0.8578	0.9338	0.9571	0.9116	0.9508	4.08	0.6499	0.8906	0.6144	0.9149	0.8267	0.9668	0.8870	12577	56.1	keep	v5.6: tighten trim 0.02 -> 0.1 to recover ±2σ_signal
f6a044f	2026-04-14	0.8503	0.9252	0.9204	0.9301	0.9560	3.82	0.6556	0.8281	0.6223	0.9574	0.8867	0.9698	0.8957	12577	55.9	keep	v5.7: FWHM measured on ±0.5 oct (avoid co-occurring band contamination)
f6a044f	2026-04-14	0.8579	0.9360	0.9461	0.9261	0.9573	3.41	0.6557	0.8594	0.6264	0.9362	0.8733	0.9698	0.8957	12577	56.3	keep	v5.7: FWHM ±0.75 oct (keep broadband rejection, unblock co-occurrence)
e642972	2026-04-14	0.8541	0.9226	0.9422	0.9037	0.9474	4.91	0.6535	0.8906	0.6174	0.9149	0.8933	0.9366	0.8609	12577	56.1	keep	v5.8: tighten fwhm threshold 0.3 -> 0.25 (paired with ±0.75 oct window)
e642972	2026-04-14	0.8572	0.9380	0.9475	0.9288	0.9545	3.69	0.6509	0.8594	0.6232	0.9149	0.8800	0.9698	0.9043	12583	56.3	keep	v5.8: exclude super_qp120 from bg rows (uncontaminated extrapolation)
6b77bb2	2026-04-14	0.8512	0.9224	0.9048	0.9406	0.9074	5.81	0.6621	0.8594	0.6167	0.9149	0.9400	0.9698	0.9043	12583	56.5	keep	v5.9: harmonic ratio 0.5 -> 0.25 (less aggressive co-occurrence kill)
6b77bb2	2026-04-14	0.8543	0.9268	0.9025	0.9525	0.9030	6.05	0.6669	0.8594	0.6241	0.9149	0.9467	0.9819	0.9217	12586	57.0	keep	v5.9b: harmonic filter requires overlap >=90% of long duration (co-occurrence safe)
6b77bb2	2026-04-14	0.8729	0.9407	0.9502	0.9314	0.9632	3.00	0.7080	0.8594	0.6540	0.9149	0.8867	0.9728	0.9043	12583	56.5	keep	v5.9: trim 0.15 (tighter for short packets)
452356b	2026-04-14	0.8836	0.9414	0.9503	0.9327	0.9618	3.03	0.7570	0.8594	0.6894	0.9149	0.8933	0.9728	0.9043	12583	56.1	keep	v5.10: trim 0.20
452356b	2026-04-14	0.8897	0.9414	0.9503	0.9327	0.9675	2.48	0.7862	0.8594	0.7057	0.9149	0.8933	0.9728	0.9043	12583	56.0	keep	v5.11: trim 0.25
452356b	2026-04-14	0.8933	0.9401	0.9489	0.9314	0.9688	2.45	0.8089	0.8594	0.7213	0.8936	0.8933	0.9728	0.9043	12583	56.4	keep	v5.12: trim 0.30
452356b	2026-04-14	0.8941	0.9401	0.9489	0.9314	0.9717	2.32	0.8141	0.8594	0.7308	0.8936	0.8933	0.9728	0.9043	12583	56.1	keep	v5.13: trim 0.40
452356b	2026-04-14	0.8826	0.9321	0.9409	0.9235	0.9443	4.43	0.7884	0.8594	0.7185	0.8936	0.8933	0.9728	0.8783	12583	56.5	keep	v5.14: trim 0.50
452356b	2026-04-14	0.8941	0.9401	0.9489	0.9314	0.9717	2.32	0.8141	0.8594	0.7308	0.8936	0.8933	0.9728	0.9043	12583	56.2	keep	v5.15: trim 0.40 (empirical optimum)
70079c7	2026-04-14	0.8962	0.9464	0.9619	0.9314	0.9731	2.23	0.8138	0.8594	0.7289	0.8936	0.8933	0.9728	0.9043	12583	56.5	keep	v5.16: dedup window 3h -> 6h (catch chirp ridges)
70079c7	2026-04-14	0.8954	0.9450	0.9617	0.9288	0.9730	2.17	0.8137	0.8594	0.7281	0.8936	0.8867	0.9698	0.9043	12583	56.4	keep	v5.17: dedup 8h
d0afab1	2026-04-14	0.9179	0.9486	0.9595	0.9380	0.9733	2.26	0.8142	0.8594	0.7376	0.8298	0.8867	0.9728	0.9435	12583	56.2	keep	v5.18: extend bg exclusion to 200min (wavelet smearing)
d0afab1	2026-04-14	0.9170	0.9479	0.9595	0.9367	0.9761	2.20	0.8102	0.8594	0.7373	0.8298	0.8933	0.9698	0.9391	12583	56.1	keep	v5.18b: exclusion 190min
d0afab1	2026-04-14	0.9202	0.9486	0.9595	0.9380	0.9719	2.32	0.8133	0.8750	0.7364	0.8511	0.8867	0.9728	0.9391	12583	56.4	keep	v5.18c: exclusion 210min
d0afab1	2026-04-14	0.9196	0.9474	0.9557	0.9393	0.9691	2.59	0.8130	0.8750	0.7358	0.8511	0.8867	0.9789	0.9348	12583	56.3	keep	v5.18d: exclusion 220min
4d004a9	2026-04-14	0.9200	0.9480	0.9582	0.9380	0.9719	2.32	0.8133	0.8750	0.7360	0.8511	0.8867	0.9728	0.9391	12596	56.3	keep	v5.19: phase-locking check in harmonic filter
4d004a9	2026-04-14	0.9199	0.9464	0.9495	0.9433	0.9706	2.37	0.8135	0.8750	0.7359	0.8511	0.9000	0.9728	0.9478	12583	56.4	keep	v5.20: harmonic env_corr 0.95 -> 0.995
4d004a9	2026-04-14	0.9184	0.9381	0.9179	0.9591	0.9697	2.40	0.8127	0.8750	0.7358	0.8511	0.9400	0.9849	0.9565	12586	56.3	keep	v5.21: harmonic filter requires >=80% overlap of LONG too (real harmonics share envelope)
4d004a9	2026-04-14	0.9164	0.9416	0.9590	0.9248	0.9729	2.42	0.8130	0.8750	0.7333	0.8511	0.8333	0.9728	0.9304	12583	56.1	keep	v5.22: min_coherence 0.9 -> 0.95
4d004a9	2026-04-14	0.9214	0.9501	0.9584	0.9420	0.9720	2.30	0.8144	0.8750	0.7375	0.8511	0.8933	0.9728	0.9478	12583	56.1	keep	v5.23: n_sigma 4.5 -> 5.0
4d004a9	2026-04-14	0.9215	0.9507	0.9597	0.9420	0.9720	2.28	0.8138	0.8750	0.7383	0.8511	0.9000	0.9728	0.9435	12583	55.9	keep	v5.24: n_sigma 5.5
4d004a9	2026-04-14	0.9218	0.9519	0.9635	0.9406	0.9734	2.28	0.8136	0.8750	0.7383	0.8511	0.9000	0.9728	0.9391	12583	55.6	keep	v5.25: n_sigma 6.0
4d004a9	2026-04-14	0.9202	0.9498	0.9646	0.9354	0.9732	2.18	0.8121	0.8750	0.7362	0.8511	0.8933	0.9698	0.9304	12583	55.2	keep	v5.26: n_sigma 7.0
4d004a9	2026-04-14	0.9218	0.9519	0.9635	0.9406	0.9734	2.28	0.8136	0.8750	0.7383	0.8511	0.9000	0.9728	0.9391	12583	55.9	keep	v5.27: final n_sigma=6.0
8307c9a	2026-04-14	0.9218	0.9519	0.9635	0.9406	0.9734	2.28	0.8136	0.8750	0.7383	0.8511	0.9000	0.9728	0.9391	12583	56.4	keep	v5.28: baseline check
8307c9a	2026-04-14	0.9218	0.9519	0.9635	0.9406	0.9734	2.28	0.8136	0.8750	0.7383	0.8511	0.9000	0.9728	0.9391	12583	59.1	keep	baseline-detail
8307c9a	2026-04-14	0.9218	0.9519	0.9635	0.9406	0.9734	2.28	0.8136	0.8750	0.7383	0.8511	0.9000	0.9728	0.9391	12583	58.6	keep	detail-view
8307c9a	2026-04-14	0.9124	0.9359	0.9572	0.9156	0.9481	4.72	0.8086	0.8906	0.7151	0.8511	0.8867	0.9366	0.9174	12584	56.7	keep	v5.28: max_fwhm 0.30 -> 0.25 (reject broader decoys)
8307c9a	2026-04-14	0.9226	0.9519	0.9635	0.9406	0.9719	2.34	0.8173	0.8750	0.7361	0.8511	0.9000	0.9728	0.9391	12583	54.7	keep	v5.28: trim 0.40 -> 0.35
8307c9a	2026-04-14	0.9212	0.9519	0.9635	0.9406	0.9705	2.40	0.8091	0.8750	0.7287	0.8511	0.9000	0.9728	0.9391	12583	54.2	keep	v5.28b: trim 0.30
8307c9a	2026-04-14	0.9228	0.9526	0.9648	0.9406	0.9719	2.34	0.8173	0.8750	0.7369	0.8511	0.9000	0.9728	0.9391	12583	54.3	keep	v5.29: harmonic env_corr 0.95 -> 0.90
8307c9a	2026-04-14	0.9228	0.9526	0.9648	0.9406	0.9719	2.34	0.8173	0.8750	0.7369	0.8511	0.9000	0.9728	0.9391	12583	54.3	keep	v5.29b: env_corr 0.85
8307c9a	2026-04-14	0.9230	0.9532	0.9661	0.9406	0.9719	2.34	0.8173	0.8750	0.7369	0.8511	0.9000	0.9728	0.9391	12583	54.3	keep	v5.29c: env_corr 0.80
8307c9a	2026-04-14	0.9230	0.9532	0.9661	0.9406	0.9719	2.34	0.8173	0.8750	0.7369	0.8511	0.9000	0.9728	0.9391	12583	55.7	keep	v5.29d: env_corr 0.70
8307c9a	2026-04-14	0.9230	0.9532	0.9661	0.9406	0.9719	2.34	0.8173	0.8750	0.7369	0.8511	0.9000	0.9728	0.9391	12583	57.1	keep	check decoys
8307c9a	2026-04-14	0.9230	0.9532	0.9661	0.9406	0.9719	2.34	0.8173	0.8750	0.7369	0.8511	0.9000	0.9728	0.9391	12583	56.5	keep	check
8307c9a	2026-04-14	0.9160	0.9409	0.9692	0.9142	0.9711	2.31	0.8186	0.8750	0.7253	0.8511	0.8067	0.9668	0.9217	12594	56.7	keep	v5.30: envelope correlation between perp components >= 0.5
8307c9a	2026-04-14	0.9303	0.9446	0.9815	0.9103	0.9710	2.41	0.8164	0.9688	0.7231	0.8511	0.7933	0.9698	0.9130	12592	54.6	keep	v5.30: global phase coherence >=0.95 rejects broadband decoys
8307c9a	2026-04-14	0.9274	0.9469	0.9789	0.9169	0.9712	2.41	0.8162	0.9375	0.7261	0.8511	0.7933	0.9698	0.9348	12592	54.4	keep	v5.30b: coh_glob >= 0.90
8307c9a	2026-04-14	0.9289	0.9379	0.9827	0.8971	0.9721	2.29	0.8164	0.9844	0.7178	0.8298	0.7933	0.9607	0.8870	12592	54.9	keep	v5.30c: coh_glob >= 0.97
8307c9a	2026-04-14	0.9303	0.9446	0.9815	0.9103	0.9710	2.41	0.8164	0.9688	0.7231	0.8511	0.7933	0.9698	0.9130	12592	54.7	keep	v5.30 FINAL: coh_glob >= 0.95 (locked)
4a7c7a3	2026-04-14	0.9303	0.9446	0.9815	0.9103	0.9710	2.41	0.8164	0.9688	0.7231	0.8511	0.7933	0.9698	0.9130	12592	54.9	keep	post-coh_glob detail
4a7c7a3	2026-04-14	0.9344	0.9547	0.9792	0.9314	0.9717	2.36	0.8170	0.9531	0.7344	0.8511	0.9000	0.9698	0.9130	12595	56.6	keep	v5.31: skip coh_glob for linear polarization (power ratio > 10)
f885a6d	2026-04-14	0.9362	0.9610	0.9808	0.9420	0.9748	1.91	0.8193	0.9375	0.7422	0.9362	0.9067	0.9789	0.9130	12642	57.1	keep	v5.32: split fused ridges by intra-ridge peak detection
ad512e1	2026-04-14	0.9362	0.9610	0.9808	0.9420	0.9748	1.91	0.8193	0.9375	0.7422	0.9362	0.9067	0.9789	0.9130	12641	57.4	keep	post-splitter detail
ad512e1	2026-04-14	0.9362	0.9610	0.9808	0.9420	0.9748	1.91	0.8193	0.9375	0.7422	0.9362	0.9067	0.9789	0.9130	12641	56.0	keep	detail2
ad512e1	2026-04-14	0.9362	0.9610	0.9808	0.9420	0.9748	1.91	0.8193	0.9375	0.7422	0.9362	0.9067	0.9789	0.9130	12641	56.7	keep	detail3
ad512e1	2026-04-14	0.9362	0.9610	0.9808	0.9420	0.9748	1.91	0.8193	0.9375	0.7422	0.9362	0.9067	0.9789	0.9130	12641	56.8	keep	detail4
ad512e1	2026-04-14	0.9414	0.9629	0.9848	0.9420	0.9748	1.91	0.8193	0.9688	0.7426	0.9362	0.9067	0.9789	0.9130	12641	56.4	keep	v5.33: linear-pol exempt threshold 10 -> 20
f9c14fe	2026-04-14	0.9403	0.9572	0.9860	0.9301	0.9745	1.88	0.8195	0.9844	0.7373	0.9362	0.9067	0.9698	0.8870	12641	55.0	keep	v5.34: coh_glob 0.95 -> 0.97 (with 20x exemption)
f9c14fe	2026-04-14	0.9437	0.9671	0.9850	0.9499	0.9722	1.94	0.8203	0.9688	0.7455	0.9787	0.9200	0.9849	0.9130	12641	55.6	keep	v5.34: splitter thresholds 0.5/0.2 -> 0.3/0.1
a483adb	2026-04-14	0.9432	0.9658	0.9823	0.9499	0.9694	1.97	0.8210	0.9688	0.7451	0.9787	0.9133	0.9819	0.9217	12641	55.9	keep	v5.35: n_sigma 6.0 -> 5.0 after coh_glob reduces FP risk
a483adb	2026-04-14	0.9454	0.9664	0.9836	0.9499	0.9694	1.95	0.8205	0.9844	0.7454	0.9787	0.9200	0.9819	0.9174	12641	54.9	keep	v5.35b: n_sigma 5.5
a483adb	2026-04-14	0.9451	0.9657	0.9836	0.9485	0.9694	1.97	0.8207	0.9844	0.7451	0.9787	0.9133	0.9819	0.9174	12641	55.3	keep	v5.35c: n_sigma 5.25
a483adb	2026-04-14	0.9454	0.9664	0.9836	0.9499	0.9694	1.95	0.8205	0.9844	0.7454	0.9787	0.9200	0.9819	0.9174	12641	54.6	keep	v5.35 FINAL: n_sigma 6.0 -> 5.5 (coh_glob enables looser threshold)
